"No.","Time","Source","Destination","Protocol","Length","Info"
"1","0.000000","108.62.5.3","10.120.238.0","TCP","1514","[TCP segment of a reassembled PDU]"
"2","0.053207","10.120.238.0","108.62.5.3","TCP","54","49236  >  443 [ACK] Seq=1 Ack=1461 Win=32964 Len=0"
"3","0.314650","108.62.5.3","10.120.238.0","TCP","1514","[TCP segment of a reassembled PDU]"
"4","0.315989","108.62.5.3","10.120.238.0","TCP","1514","[TCP segment of a reassembled PDU]"
"5","0.315989","108.62.5.3","10.120.238.0","TCP","1514","[TCP segment of a reassembled PDU]"
"6","0.316075","10.120.238.0","108.62.5.3","TCP","54","49236  >  443 [ACK] Seq=1 Ack=5841 Win=32964 Len=0"
"7","0.316772","108.62.5.3","10.120.238.0","SSLv2","1514","Encrypted Data"
"8","0.316830","10.120.238.0","108.62.5.3","TCP","54","49236  >  443 [ACK] Seq=1 Ack=7301 Win=32964 Len=0"
"9","0.317646","108.62.5.3","10.120.238.0","TCP","1514","[TCP segment of a reassembled PDU]"
"10","0.319388","108.62.5.3","10.120.238.0","TCP","1514","[TCP segment of a reassembled PDU]"
"11","0.319388","108.62.5.3","10.120.238.0","TCP","1514","[TCP segment of a reassembled PDU]"
"12","0.319421","10.120.238.0","108.62.5.3","TCP","54","49236  >  443 [ACK] Seq=1 Ack=11681 Win=32964 Len=0"
"13","0.321960","108.62.5.3","10.120.238.0","TCP","1514","[TCP segment of a reassembled PDU]"
"14","0.321960","108.62.5.3","10.120.238.0","TCP","1514","[TCP segment of a reassembled PDU]"
"15","0.321960","108.62.5.3","10.120.238.0","TCP","1514","[TCP segment of a reassembled PDU]"
"16","0.321960","108.62.5.3","10.120.238.0","TCP","1514","[TCP segment of a reassembled PDU]"
"17","0.322033","10.120.238.0","108.62.5.3","TCP","54","49236  >  443 [ACK] Seq=1 Ack=17521 Win=32964 Len=0"
"18","0.324882","108.62.5.3","10.120.238.0","TCP","1514","[TCP segment of a reassembled PDU]"
"19","0.324882","108.62.5.3","10.120.238.0","TCP","1514","[TCP segment of a reassembled PDU]"
"20","0.324882","108.62.5.3","10.120.238.0","TCP","1514","[TCP segment of a reassembled PDU]"
"21","0.324882","108.62.5.3","10.120.238.0","TCP","1514","[TCP segment of a reassembled PDU]"
"22","0.324938","10.120.238.0","108.62.5.3","TCP","54","49236  >  443 [ACK] Seq=1 Ack=23361 Win=32964 Len=0"
"23","0.328454","108.62.5.3","10.120.238.0","TCP","1514","[TCP segment of a reassembled PDU]"
"24","0.328454","108.62.5.3","10.120.238.0","TCP","1514","[TCP segment of a reassembled PDU]"
"25","0.328454","108.62.5.3","10.120.238.0","TCP","1514","[TCP segment of a reassembled PDU]"
"26","0.328454","108.62.5.3","10.120.238.0","TCP","1514","[TCP segment of a reassembled PDU]"
"27","0.328454","108.62.5.3","10.120.238.0","TCP","1514","[TCP segment of a reassembled PDU]"
"28","0.328454","108.62.5.3","10.120.238.0","TCP","1514","[TCP segment of a reassembled PDU]"
"29","0.328454","108.62.5.3","10.120.238.0","TCP","1514","[TCP segment of a reassembled PDU]"
"30","0.328454","108.62.5.3","10.120.238.0","TCP","1514","[TCP segment of a reassembled PDU]"
"31","0.328454","108.62.5.3","10.120.238.0","TCP","1514","[TCP segment of a reassembled PDU]"
"32","0.328454","108.62.5.3","10.120.238.0","TCP","1514","[TCP segment of a reassembled PDU]"
"33","0.328454","108.62.5.3","10.120.238.0","TCP","1514","[TCP segment of a reassembled PDU]"
"34","0.328454","108.62.5.3","10.120.238.0","TCP","1514","[TCP segment of a reassembled PDU]"
"35","0.328454","108.62.5.3","10.120.238.0","TCP","1514","[TCP segment of a reassembled PDU]"
"36","0.328454","108.62.5.3","10.120.238.0","TCP","1514","[TCP segment of a reassembled PDU]"
"37","0.328454","108.62.5.3","10.120.238.0","TCP","1514","[TCP segment of a reassembled PDU]"
"38","0.328454","108.62.5.3","10.120.238.0","SSLv2","1514","Encrypted Data"
"39","0.328454","108.62.5.3","10.120.238.0","TCP","1514","[TCP segment of a reassembled PDU]"
"40","0.328454","108.62.5.3","10.120.238.0","TCP","1514","[TCP segment of a reassembled PDU]"
"41","0.328454","108.62.5.3","10.120.238.0","TCP","1514","[TCP segment of a reassembled PDU]"
"42","0.328454","108.62.5.3","10.120.238.0","TCP","1514","[TCP segment of a reassembled PDU]"
"43","0.328454","108.62.5.3","10.120.238.0","TCP","1514","[TCP segment of a reassembled PDU]"
"44","0.328454","108.62.5.3","10.120.238.0","SSLv2","1514","Encrypted Data"
"45","0.328454","108.62.5.3","10.120.238.0","TCP","1514","[TCP segment of a reassembled PDU]"
"46","0.328454","108.62.5.3","10.120.238.0","TCP","1514","[TCP segment of a reassembled PDU]"
"47","0.328454","108.62.5.3","10.120.238.0","TCP","1514","[TCP segment of a reassembled PDU]"
"48","0.328454","108.62.5.3","10.120.238.0","TCP","1514","443  >  49236 [ACK] Seq=59861 Ack=1 Win=135 Len=1460"
"49","0.328454","108.62.5.3","10.120.238.0","TCP","1514","[TCP segment of a reassembled PDU]"
"50","0.328454","108.62.5.3","10.120.238.0","TCP","1514","[TCP segment of a reassembled PDU]"
"51","0.328454","108.62.5.3","10.120.238.0","TCP","1514","[TCP segment of a reassembled PDU]"
"52","0.328454","108.62.5.3","10.120.238.0","TCP","1514","[TCP segment of a reassembled PDU]"
"53","0.328454","108.62.5.3","10.120.238.0","TCP","1514","[TCP segment of a reassembled PDU]"
"54","0.328759","10.120.238.0","108.62.5.3","TCP","54","49236  >  443 [ACK] Seq=1 Ack=68621 Win=32964 Len=0"
"55","0.332008","108.62.5.3","10.120.238.0","TCP","1514","[TCP segment of a reassembled PDU]"
"56","0.332008","108.62.5.3","10.120.238.0","TCP","1514","[TCP segment of a reassembled PDU]"
"57","0.332008","108.62.5.3","10.120.238.0","TCP","1514","[TCP segment of a reassembled PDU]"
"58","0.332008","108.62.5.3","10.120.238.0","TCP","1514","[TCP segment of a reassembled PDU]"
"59","0.332008","108.62.5.3","10.120.238.0","TCP","1514","[TCP segment of a reassembled PDU]"
"60","0.332008","108.62.5.3","10.120.238.0","TCP","1514","[TCP segment of a reassembled PDU]"
"61","0.332008","108.62.5.3","10.120.238.0","TCP","1514","[TCP segment of a reassembled PDU]"
"62","0.332008","108.62.5.3","10.120.238.0","TCP","1514","[TCP segment of a reassembled PDU]"
"63","0.332008","108.62.5.3","10.120.238.0","TCP","1514","[TCP segment of a reassembled PDU]"
"64","0.332008","108.62.5.3","10.120.238.0","TCP","1514","[TCP segment of a reassembled PDU]"
"65","0.332008","108.62.5.3","10.120.238.0","TCP","1514","443  >  49236 [ACK] Seq=83221 Ack=1 Win=135 Len=1460 [TCP segment of a reassembled PDU]"
"66","0.332008","108.62.5.3","10.120.238.0","TCP","1514","443  >  49236 [ACK] Seq=84681 Ack=1 Win=135 Len=1460 [TCP segment of a reassembled PDU]"
"67","0.332008","108.62.5.3","10.120.238.0","TCP","1514","443  >  49236 [ACK] Seq=86141 Ack=1 Win=135 Len=1460 [TCP segment of a reassembled PDU]"
"68","0.332008","108.62.5.3","10.120.238.0","TCP","1514","443  >  49236 [ACK] Seq=87601 Ack=1 Win=135 Len=1460 [TCP segment of a reassembled PDU]"
"69","0.332008","108.62.5.3","10.120.238.0","TCP","1514","443  >  49236 [ACK] Seq=89061 Ack=1 Win=135 Len=1460 [TCP segment of a reassembled PDU]"
"70","0.332008","108.62.5.3","10.120.238.0","TCP","1514","443  >  49236 [ACK] Seq=90521 Ack=1 Win=135 Len=1460 [TCP segment of a reassembled PDU]"
"71","0.332008","108.62.5.3","10.120.238.0","TCP","1514","443  >  49236 [ACK] Seq=91981 Ack=1 Win=135 Len=1460 [TCP segment of a reassembled PDU]"
"72","0.332008","108.62.5.3","10.120.238.0","TCP","1514","443  >  49236 [ACK] Seq=93441 Ack=1 Win=135 Len=1460 [TCP segment of a reassembled PDU]"
"73","0.332008","108.62.5.3","10.120.238.0","TCP","1514","443  >  49236 [ACK] Seq=94901 Ack=1 Win=135 Len=1460 [TCP segment of a reassembled PDU]"
"74","0.332008","108.62.5.3","10.120.238.0","TCP","1514","443  >  49236 [ACK] Seq=96361 Ack=1 Win=135 Len=1460 [TCP segment of a reassembled PDU]"
"75","0.332008","108.62.5.3","10.120.238.0","TCP","1514","443  >  49236 [ACK] Seq=97821 Ack=1 Win=135 Len=1460 [TCP segment of a reassembled PDU]"
"76","0.332008","108.62.5.3","10.120.238.0","TCP","1514","443  >  49236 [ACK] Seq=99281 Ack=1 Win=135 Len=1460 [TCP segment of a reassembled PDU]"
"77","0.332008","108.62.5.3","10.120.238.0","TCP","1514","443  >  49236 [ACK] Seq=100741 Ack=1 Win=135 Len=1460 [TCP segment of a reassembled PDU]"
"78","0.332008","108.62.5.3","10.120.238.0","TCP","1514","443  >  49236 [ACK] Seq=102201 Ack=1 Win=135 Len=1460 [TCP segment of a reassembled PDU]"
"79","0.332008","108.62.5.3","10.120.238.0","TCP","1514","443  >  49236 [ACK] Seq=103661 Ack=1 Win=135 Len=1460 [TCP segment of a reassembled PDU]"
"80","0.332008","108.62.5.3","10.120.238.0","TCP","1514","443  >  49236 [ACK] Seq=105121 Ack=1 Win=135 Len=1460 [TCP segment of a reassembled PDU]"
"81","0.332008","108.62.5.3","10.120.238.0","TCP","1514","443  >  49236 [ACK] Seq=106581 Ack=1 Win=135 Len=1460 [TCP segment of a reassembled PDU]"
"82","0.332008","108.62.5.3","10.120.238.0","TCP","1514","443  >  49236 [ACK] Seq=108041 Ack=1 Win=135 Len=1460 [TCP segment of a reassembled PDU]"
"83","0.332008","108.62.5.3","10.120.238.0","TCP","1514","443  >  49236 [ACK] Seq=109501 Ack=1 Win=135 Len=1460 [TCP segment of a reassembled PDU]"
"84","0.332008","108.62.5.3","10.120.238.0","TCP","1514","443  >  49236 [ACK] Seq=110961 Ack=1 Win=135 Len=1460 [TCP segment of a reassembled PDU]"
"85","0.332008","108.62.5.3","10.120.238.0","SSLv2","1514","Encrypted Data [TCP segment of a reassembled PDU]"
"86","0.332288","10.120.238.0","108.62.5.3","TCP","54","49236  >  443 [ACK] Seq=1 Ack=113881 Win=32964 Len=0"
"87","0.332612","10.120.238.0","108.62.5.3","TCP","96","49236  >  443 [PSH, ACK] Seq=1 Ack=113881 Win=32964 Len=42 [TCP segment of a reassembled PDU]"
"88","0.335108","108.62.5.3","10.120.238.0","TCP","1514","443  >  49236 [ACK] Seq=113881 Ack=1 Win=135 Len=1460 [TCP segment of a reassembled PDU]"
"89","0.335108","108.62.5.3","10.120.238.0","TCP","1514","443  >  49236 [ACK] Seq=115341 Ack=1 Win=135 Len=1460 [TCP segment of a reassembled PDU]"
"90","0.335108","108.62.5.3","10.120.238.0","TCP","1514","443  >  49236 [ACK] Seq=116801 Ack=1 Win=135 Len=1460 [TCP segment of a reassembled PDU]"
"91","0.335108","108.62.5.3","10.120.238.0","TCP","1514","443  >  49236 [ACK] Seq=118261 Ack=1 Win=135 Len=1460 [TCP segment of a reassembled PDU]"
"92","0.335108","108.62.5.3","10.120.238.0","TCP","1514","443  >  49236 [ACK] Seq=119721 Ack=1 Win=135 Len=1460 [TCP segment of a reassembled PDU]"
"93","0.335108","108.62.5.3","10.120.238.0","TCP","1514","443  >  49236 [ACK] Seq=121181 Ack=1 Win=135 Len=1460 [TCP segment of a reassembled PDU]"
"94","0.335108","108.62.5.3","10.120.238.0","TCP","1514","443  >  49236 [ACK] Seq=122641 Ack=1 Win=135 Len=1460 [TCP segment of a reassembled PDU]"
"95","0.335108","108.62.5.3","10.120.238.0","TCP","1514","443  >  49236 [ACK] Seq=124101 Ack=1 Win=135 Len=1460 [TCP segment of a reassembled PDU]"
"96","0.335108","108.62.5.3","10.120.238.0","SSLv2","1514","Encrypted Data [TCP segment of a reassembled PDU]"
"97","0.335108","108.62.5.3","10.120.238.0","TCP","1514","443  >  49236 [ACK] Seq=127021 Ack=1 Win=135 Len=1460 [TCP segment of a reassembled PDU]"
"98","0.335108","108.62.5.3","10.120.238.0","TCP","1514","443  >  49236 [ACK] Seq=128481 Ack=1 Win=135 Len=1460 [TCP segment of a reassembled PDU]"
"99","0.335108","108.62.5.3","10.120.238.0","SSLv2","1514","Encrypted Data [TCP segment of a reassembled PDU]"
"100","0.335108","108.62.5.3","10.120.238.0","TCP","1514","443  >  49236 [ACK] Seq=131401 Ack=1 Win=135 Len=1460 [TCP segment of a reassembled PDU]"
"101","0.335108","108.62.5.3","10.120.238.0","SSLv2","1514","Encrypted Data [TCP segment of a reassembled PDU]"
"102","0.335108","108.62.5.3","10.120.238.0","TCP","1514","443  >  49236 [ACK] Seq=134321 Ack=1 Win=135 Len=1460 [TCP segment of a reassembled PDU]"
"103","0.335108","108.62.5.3","10.120.238.0","TCP","1514","443  >  49236 [ACK] Seq=135781 Ack=1 Win=135 Len=1460 [TCP segment of a reassembled PDU]"
"104","0.335108","108.62.5.3","10.120.238.0","TCP","1514","443  >  49236 [ACK] Seq=137241 Ack=1 Win=135 Len=1460 [TCP segment of a reassembled PDU]"
"105","0.335108","108.62.5.3","10.120.238.0","TCP","1514","443  >  49236 [ACK] Seq=138701 Ack=1 Win=135 Len=1460 [TCP segment of a reassembled PDU]"
"106","0.335108","108.62.5.3","10.120.238.0","TCP","1514","443  >  49236 [ACK] Seq=140161 Ack=1 Win=135 Len=1460 [TCP segment of a reassembled PDU]"
"107","0.335108","108.62.5.3","10.120.238.0","TCP","1514","443  >  49236 [ACK] Seq=141621 Ack=1 Win=135 Len=1460 [TCP segment of a reassembled PDU]"
"108","0.335108","108.62.5.3","10.120.238.0","TCP","1514","443  >  49236 [ACK] Seq=143081 Ack=1 Win=135 Len=1460 [TCP segment of a reassembled PDU]"
"109","0.335108","108.62.5.3","10.120.238.0","TCP","1514","443  >  49236 [ACK] Seq=144541 Ack=1 Win=135 Len=1460 [TCP segment of a reassembled PDU]"
"110","0.335108","108.62.5.3","10.120.238.0","TCP","1514","443  >  49236 [ACK] Seq=146001 Ack=1 Win=135 Len=1460 [TCP segment of a reassembled PDU]"
"111","0.335108","108.62.5.3","10.120.238.0","TCP","1514","443  >  49236 [ACK] Seq=147461 Ack=1 Win=135 Len=1460 [TCP segment of a reassembled PDU]"
"112","0.335108","108.62.5.3","10.120.238.0","TCP","1514","443  >  49236 [ACK] Seq=148921 Ack=1 Win=135 Len=1460 [TCP segment of a reassembled PDU]"
"113","0.335108","108.62.5.3","10.120.238.0","TCP","1514","443  >  49236 [ACK] Seq=150381 Ack=1 Win=135 Len=1460 [TCP segment of a reassembled PDU]"
"114","0.335108","108.62.5.3","10.120.238.0","TCP","1514","443  >  49236 [ACK] Seq=151841 Ack=1 Win=135 Len=1460 [TCP segment of a reassembled PDU]"
"115","0.335108","108.62.5.3","10.120.238.0","SSLv2","1514","Encrypted Data [TCP segment of a reassembled PDU]"
"116","0.335108","108.62.5.3","10.120.238.0","TCP","1514","443  >  49236 [ACK] Seq=154761 Ack=1 Win=135 Len=1460 [TCP segment of a reassembled PDU]"
"117","0.335108","108.62.5.3","10.120.238.0","TCP","1514","443  >  49236 [ACK] Seq=156221 Ack=1 Win=135 Len=1460 [TCP segment of a reassembled PDU]"
"118","0.335108","108.62.5.3","10.120.238.0","TCP","1514","443  >  49236 [ACK] Seq=157681 Ack=1 Win=135 Len=1460 [TCP segment of a reassembled PDU]"
"119","0.335297","10.120.238.0","108.62.5.3","TCP","54","49236  >  443 [ACK] Seq=43 Ack=159141 Win=32964 Len=0"
"120","0.341178","108.62.5.3","10.120.238.0","TCP","1514","443  >  49236 [ACK] Seq=159141 Ack=1 Win=135 Len=1460 [TCP segment of a reassembled PDU]"
"121","0.341178","108.62.5.3","10.120.238.0","TCP","1514","443  >  49236 [ACK] Seq=160601 Ack=1 Win=135 Len=1460 [TCP segment of a reassembled PDU]"
"122","0.341178","108.62.5.3","10.120.238.0","TCP","1514","443  >  49236 [ACK] Seq=162061 Ack=1 Win=135 Len=1460 [TCP segment of a reassembled PDU]"
"123","0.341178","108.62.5.3","10.120.238.0","TCP","1514","443  >  49236 [ACK] Seq=163521 Ack=1 Win=135 Len=1460 [TCP segment of a reassembled PDU]"
"124","0.341178","108.62.5.3","10.120.238.0","TCP","1514","443  >  49236 [ACK] Seq=164981 Ack=1 Win=135 Len=1460 [TCP segment of a reassembled PDU]"
"125","0.341178","108.62.5.3","10.120.238.0","TCP","1514","443  >  49236 [ACK] Seq=166441 Ack=1 Win=135 Len=1460 [TCP segment of a reassembled PDU]"
"126","0.341178","108.62.5.3","10.120.238.0","SSLv2","1514","Encrypted Data [TCP segment of a reassembled PDU]"
"127","0.341178","108.62.5.3","10.120.238.0","TCP","1514","443  >  49236 [ACK] Seq=169361 Ack=1 Win=135 Len=1460 [TCP segment of a reassembled PDU]"
"128","0.341178","108.62.5.3","10.120.238.0","TCP","1514","443  >  49236 [ACK] Seq=170821 Ack=1 Win=135 Len=1460 [TCP segment of a reassembled PDU]"
"129","0.341178","108.62.5.3","10.120.238.0","TCP","1514","443  >  49236 [ACK] Seq=172281 Ack=1 Win=135 Len=1460 [TCP segment of a reassembled PDU]"
"130","0.341178","108.62.5.3","10.120.238.0","TCP","1514","443  >  49236 [ACK] Seq=173741 Ack=1 Win=135 Len=1460 [TCP segment of a reassembled PDU]"
"131","0.341178","108.62.5.3","10.120.238.0","TCP","1514","443  >  49236 [ACK] Seq=175201 Ack=1 Win=135 Len=1460 [TCP segment of a reassembled PDU]"
"132","0.341178","108.62.5.3","10.120.238.0","TCP","1514","443  >  49236 [ACK] Seq=176661 Ack=1 Win=135 Len=1460 [TCP segment of a reassembled PDU]"
"133","0.341178","108.62.5.3","10.120.238.0","TCP","1514","443  >  49236 [ACK] Seq=178121 Ack=1 Win=135 Len=1460 [TCP segment of a reassembled PDU]"
"134","0.341178","108.62.5.3","10.120.238.0","TCP","1514","443  >  49236 [ACK] Seq=179581 Ack=1 Win=135 Len=1460 [TCP segment of a reassembled PDU]"
"135","0.341178","108.62.5.3","10.120.238.0","TCP","1514","443  >  49236 [ACK] Seq=181041 Ack=1 Win=135 Len=1460 [TCP segment of a reassembled PDU]"
"136","0.341178","108.62.5.3","10.120.238.0","TCP","1514","443  >  49236 [ACK] Seq=182501 Ack=1 Win=135 Len=1460 [TCP segment of a reassembled PDU]"
"137","0.341178","108.62.5.3","10.120.238.0","TCP","1514","443  >  49236 [ACK] Seq=183961 Ack=1 Win=135 Len=1460 [TCP segment of a reassembled PDU]"
"138","0.341178","108.62.5.3","10.120.238.0","TCP","1514","443  >  49236 [ACK] Seq=185421 Ack=1 Win=135 Len=1460 [TCP segment of a reassembled PDU]"
"139","0.341178","108.62.5.3","10.120.238.0","TCP","1514","443  >  49236 [ACK] Seq=186881 Ack=1 Win=135 Len=1460 [TCP segment of a reassembled PDU]"
"140","0.341178","108.62.5.3","10.120.238.0","SSLv2","1514","Encrypted Data [TCP segment of a reassembled PDU]"
"141","0.341178","108.62.5.3","10.120.238.0","TCP","1514","443  >  49236 [ACK] Seq=189801 Ack=1 Win=135 Len=1460 [TCP segment of a reassembled PDU]"
"142","0.341410","10.120.238.0","108.62.5.3","TCP","54","49236  >  443 [ACK] Seq=43 Ack=191261 Win=32964 Len=0"
"143","0.630227","108.62.5.3","10.120.238.0","TCP","1514","443  >  49236 [ACK] Seq=191261 Ack=1 Win=135 Len=1460 [TCP segment of a reassembled PDU]"
"144","0.630227","108.62.5.3","10.120.238.0","TCP","1514","443  >  49236 [ACK] Seq=192721 Ack=1 Win=135 Len=1460 [TCP segment of a reassembled PDU]"
"145","0.630227","108.62.5.3","10.120.238.0","TCP","1514","443  >  49236 [ACK] Seq=194181 Ack=1 Win=135 Len=1460 [TCP segment of a reassembled PDU]"
"146","0.630227","108.62.5.3","10.120.238.0","TCP","1514","443  >  49236 [ACK] Seq=195641 Ack=1 Win=135 Len=1460 [TCP segment of a reassembled PDU]"
"147","0.630227","108.62.5.3","10.120.238.0","TCP","1514","443  >  49236 [ACK] Seq=197101 Ack=1 Win=135 Len=1460 [TCP segment of a reassembled PDU]"
"148","0.630227","108.62.5.3","10.120.238.0","TCP","1514","443  >  49236 [ACK] Seq=198561 Ack=1 Win=135 Len=1460 [TCP segment of a reassembled PDU]"
"149","0.630227","108.62.5.3","10.120.238.0","TCP","1514","443  >  49236 [ACK] Seq=200021 Ack=1 Win=135 Len=1460 [TCP segment of a reassembled PDU]"
"150","0.630227","108.62.5.3","10.120.238.0","TCP","1514","443  >  49236 [ACK] Seq=201481 Ack=1 Win=135 Len=1460 [TCP segment of a reassembled PDU]"
"151","0.630227","108.62.5.3","10.120.238.0","TCP","1514","443  >  49236 [ACK] Seq=202941 Ack=1 Win=135 Len=1460 [TCP segment of a reassembled PDU]"
"152","0.630227","108.62.5.3","10.120.238.0","TCP","1514","443  >  49236 [ACK] Seq=204401 Ack=1 Win=135 Len=1460 [TCP segment of a reassembled PDU]"
"153","0.630227","108.62.5.3","10.120.238.0","TCP","1514","443  >  49236 [ACK] Seq=205861 Ack=1 Win=135 Len=1460 [TCP segment of a reassembled PDU]"
"154","0.630227","108.62.5.3","10.120.238.0","TCP","1514","443  >  49236 [ACK] Seq=207321 Ack=1 Win=135 Len=1460 [TCP segment of a reassembled PDU]"
"155","0.630227","108.62.5.3","10.120.238.0","TCP","1514","443  >  49236 [ACK] Seq=208781 Ack=1 Win=135 Len=1460 [TCP segment of a reassembled PDU]"
"156","0.630227","108.62.5.3","10.120.238.0","TCP","1514","443  >  49236 [ACK] Seq=210241 Ack=1 Win=135 Len=1460 [TCP segment of a reassembled PDU]"
"157","0.630227","108.62.5.3","10.120.238.0","TCP","1514","443  >  49236 [ACK] Seq=211701 Ack=1 Win=135 Len=1460 [TCP segment of a reassembled PDU]"
"158","0.630227","108.62.5.3","10.120.238.0","TCP","1514","443  >  49236 [ACK] Seq=213161 Ack=1 Win=135 Len=1460 [TCP segment of a reassembled PDU]"
"159","0.630227","108.62.5.3","10.120.238.0","TCP","1514","443  >  49236 [ACK] Seq=214621 Ack=1 Win=135 Len=1460 [TCP segment of a reassembled PDU]"
"160","0.630227","108.62.5.3","10.120.238.0","TCP","1514","443  >  49236 [ACK] Seq=216081 Ack=1 Win=135 Len=1460 [TCP segment of a reassembled PDU]"
"161","0.630227","108.62.5.3","10.120.238.0","TCP","1514","443  >  49236 [ACK] Seq=217541 Ack=1 Win=135 Len=1460 [TCP segment of a reassembled PDU]"
"162","0.630227","108.62.5.3","10.120.238.0","SSLv2","1514","Encrypted Data [TCP segment of a reassembled PDU]"
"163","0.630227","108.62.5.3","10.120.238.0","TCP","1514","443  >  49236 [ACK] Seq=220461 Ack=1 Win=135 Len=1460 [TCP segment of a reassembled PDU]"
"164","0.630227","108.62.5.3","10.120.238.0","TCP","54","[TCP Previous segment not captured] 443  >  49236 [ACK] Seq=223381 Ack=43 Win=135 Len=0"
"165","0.630227","108.62.5.3","10.120.238.0","TCP","1514","[TCP Retransmission] 443  >  49236 [ACK] Seq=221921 Ack=1 Win=135 Len=1460"
"166","0.630227","108.62.5.3","10.120.238.0","TCP","1514","443  >  49236 [ACK] Seq=223381 Ack=43 Win=135 Len=1460 [TCP segment of a reassembled PDU]"
"167","0.630227","108.62.5.3","10.120.238.0","TCP","1514","443  >  49236 [ACK] Seq=224841 Ack=43 Win=135 Len=1460 [TCP segment of a reassembled PDU]"
"168","0.630227","108.62.5.3","10.120.238.0","TCP","1514","443  >  49236 [ACK] Seq=226301 Ack=43 Win=135 Len=1460 [TCP segment of a reassembled PDU]"
"169","0.630227","108.62.5.3","10.120.238.0","TCP","1514","443  >  49236 [ACK] Seq=227761 Ack=43 Win=135 Len=1460 [TCP segment of a reassembled PDU]"
"170","0.630227","108.62.5.3","10.120.238.0","TCP","1514","443  >  49236 [ACK] Seq=229221 Ack=43 Win=135 Len=1460 [TCP segment of a reassembled PDU]"
"171","0.630227","108.62.5.3","10.120.238.0","TCP","1514","443  >  49236 [ACK] Seq=230681 Ack=43 Win=135 Len=1460 [TCP segment of a reassembled PDU]"
"172","0.630227","108.62.5.3","10.120.238.0","TCP","1514","443  >  49236 [ACK] Seq=232141 Ack=43 Win=135 Len=1460 [TCP segment of a reassembled PDU] [TCP segment of a reassembled PDU]"
"173","0.630227","108.62.5.3","10.120.238.0","TCP","1514","443  >  49236 [ACK] Seq=233601 Ack=43 Win=135 Len=1460 [TCP segment of a reassembled PDU]"
"174","0.630227","108.62.5.3","10.120.238.0","TCP","1514","443  >  49236 [ACK] Seq=235061 Ack=43 Win=135 Len=1460 [TCP segment of a reassembled PDU]"
"175","0.630632","10.120.238.0","108.62.5.3","TCP","54","49236  >  443 [ACK] Seq=43 Ack=236521 Win=32964 Len=0"
"176","0.631133","108.62.5.3","10.120.238.0","TCP","1514","443  >  49236 [ACK] Seq=236521 Ack=43 Win=135 Len=1460 [TCP segment of a reassembled PDU]"
"177","0.631133","108.62.5.3","10.120.238.0","TCP","1514","443  >  49236 [ACK] Seq=237981 Ack=43 Win=135 Len=1460 [TCP segment of a reassembled PDU]"
"178","0.631133","108.62.5.3","10.120.238.0","TCP","1514","443  >  49236 [ACK] Seq=239441 Ack=43 Win=135 Len=1460 [TCP segment of a reassembled PDU]"
"179","0.631133","108.62.5.3","10.120.238.0","TCP","1514","443  >  49236 [ACK] Seq=240901 Ack=43 Win=135 Len=1460 [TCP segment of a reassembled PDU]"
"180","0.631254","10.120.238.0","108.62.5.3","TCP","54","49236  >  443 [ACK] Seq=43 Ack=242361 Win=32964 Len=0"
"181","0.633763","108.62.5.3","10.120.238.0","TCP","1514","443  >  49236 [ACK] Seq=242361 Ack=43 Win=135 Len=1460 [TCP segment of a reassembled PDU]"
"182","0.633763","108.62.5.3","10.120.238.0","SSLv2","1514","Encrypted Data [TCP segment of a reassembled PDU]"
"183","0.633763","108.62.5.3","10.120.238.0","TCP","1514","443  >  49236 [ACK] Seq=245281 Ack=43 Win=135 Len=1460 [TCP segment of a reassembled PDU]"
"184","0.633763","108.62.5.3","10.120.238.0","TCP","1514","443  >  49236 [ACK] Seq=246741 Ack=43 Win=135 Len=1460 [TCP segment of a reassembled PDU]"
"185","0.633763","108.62.5.3","10.120.238.0","TCP","1514","443  >  49236 [ACK] Seq=248201 Ack=43 Win=135 Len=1460 [TCP segment of a reassembled PDU]"
"186","0.633763","108.62.5.3","10.120.238.0","SSLv2","1514","Encrypted Data [TCP segment of a reassembled PDU]"
"187","0.633763","108.62.5.3","10.120.238.0","TCP","1514","443  >  49236 [ACK] Seq=251121 Ack=43 Win=135 Len=1460 [TCP segment of a reassembled PDU]"
"188","0.633763","108.62.5.3","10.120.238.0","TCP","1514","443  >  49236 [ACK] Seq=252581 Ack=43 Win=135 Len=1460 [TCP segment of a reassembled PDU]"
"189","0.633763","108.62.5.3","10.120.238.0","SSLv2","1514","Encrypted Data [TCP segment of a reassembled PDU]"
"190","0.633763","108.62.5.3","10.120.238.0","TCP","1514","443  >  49236 [ACK] Seq=255501 Ack=43 Win=135 Len=1460 [TCP segment of a reassembled PDU]"
"191","0.633763","108.62.5.3","10.120.238.0","TCP","1514","443  >  49236 [ACK] Seq=256961 Ack=43 Win=135 Len=1460 [TCP segment of a reassembled PDU]"
"192","0.633763","108.62.5.3","10.120.238.0","TCP","1514","443  >  49236 [ACK] Seq=258421 Ack=43 Win=135 Len=1460 [TCP segment of a reassembled PDU]"
"193","0.633763","108.62.5.3","10.120.238.0","TCP","1514","443  >  49236 [ACK] Seq=259881 Ack=43 Win=135 Len=1460 [TCP segment of a reassembled PDU]"
"194","0.633763","108.62.5.3","10.120.238.0","TCP","1514","443  >  49236 [ACK] Seq=261341 Ack=43 Win=135 Len=1460 [TCP segment of a reassembled PDU]"
"195","0.633763","108.62.5.3","10.120.238.0","TCP","1514","443  >  49236 [ACK] Seq=262801 Ack=43 Win=135 Len=1460 [TCP segment of a reassembled PDU]"
"196","0.633763","108.62.5.3","10.120.238.0","SSLv2","1514","Encrypted Data [TCP segment of a reassembled PDU]"
"197","0.633763","108.62.5.3","10.120.238.0","SSLv2","1514","Encrypted Data [TCP segment of a reassembled PDU]"
"198","0.633763","108.62.5.3","10.120.238.0","TCP","1514","443  >  49236 [ACK] Seq=267181 Ack=43 Win=135 Len=1460 [TCP segment of a reassembled PDU]"
"199","0.633763","108.62.5.3","10.120.238.0","TCP","1514","443  >  49236 [ACK] Seq=268641 Ack=43 Win=135 Len=1460 [TCP segment of a reassembled PDU]"
"200","0.633763","108.62.5.3","10.120.238.0","TCP","1514","443  >  49236 [ACK] Seq=270101 Ack=43 Win=135 Len=1460 [TCP segment of a reassembled PDU]"
"201","0.633763","108.62.5.3","10.120.238.0","TCP","1514","443  >  49236 [ACK] Seq=271561 Ack=43 Win=135 Len=1460 [TCP segment of a reassembled PDU]"
"202","0.633763","108.62.5.3","10.120.238.0","TCP","1514","443  >  49236 [ACK] Seq=273021 Ack=43 Win=135 Len=1460 [TCP segment of a reassembled PDU]"
"203","0.633763","108.62.5.3","10.120.238.0","TCP","1514","443  >  49236 [ACK] Seq=274481 Ack=43 Win=135 Len=1460 [TCP segment of a reassembled PDU]"
"204","0.633763","108.62.5.3","10.120.238.0","TCP","1514","443  >  49236 [ACK] Seq=275941 Ack=43 Win=135 Len=1460 [TCP segment of a reassembled PDU]"
"205","0.633763","108.62.5.3","10.120.238.0","TCP","1514","443  >  49236 [ACK] Seq=277401 Ack=43 Win=135 Len=1460 [TCP segment of a reassembled PDU]"
"206","0.633763","108.62.5.3","10.120.238.0","TCP","1514","443  >  49236 [ACK] Seq=278861 Ack=43 Win=135 Len=1460 [TCP segment of a reassembled PDU]"
"207","0.633763","108.62.5.3","10.120.238.0","TCP","1514","443  >  49236 [ACK] Seq=280321 Ack=43 Win=135 Len=1460 [TCP segment of a reassembled PDU]"
"208","0.634110","10.120.238.0","108.62.5.3","TCP","54","49236  >  443 [ACK] Seq=43 Ack=281781 Win=32964 Len=0"
"209","0.637108","108.62.5.3","10.120.238.0","TCP","1514","443  >  49236 [ACK] Seq=281781 Ack=43 Win=135 Len=1460 [TCP segment of a reassembled PDU]"
"210","0.637108","108.62.5.3","10.120.238.0","TCP","1514","443  >  49236 [ACK] Seq=283241 Ack=43 Win=135 Len=1460 [TCP segment of a reassembled PDU]"
"211","0.637108","108.62.5.3","10.120.238.0","TCP","1514","443  >  49236 [ACK] Seq=284701 Ack=43 Win=135 Len=1460 [TCP segment of a reassembled PDU]"
"212","0.637108","108.62.5.3","10.120.238.0","SSLv2","1514","Encrypted Data [TCP segment of a reassembled PDU]"
"213","0.637108","108.62.5.3","10.120.238.0","TCP","1514","443  >  49236 [ACK] Seq=287621 Ack=43 Win=135 Len=1460 [TCP segment of a reassembled PDU]"
"214","0.637108","108.62.5.3","10.120.238.0","TCP","1514","443  >  49236 [ACK] Seq=289081 Ack=43 Win=135 Len=1460 [TCP segment of a reassembled PDU]"
"215","0.637108","108.62.5.3","10.120.238.0","TCP","1514","443  >  49236 [ACK] Seq=290541 Ack=43 Win=135 Len=1460 [TCP segment of a reassembled PDU]"
"216","0.637108","108.62.5.3","10.120.238.0","TCP","1514","443  >  49236 [ACK] Seq=292001 Ack=43 Win=135 Len=1460 [TCP segment of a reassembled PDU]"
"217","0.637108","108.62.5.3","10.120.238.0","TCP","1514","443  >  49236 [ACK] Seq=293461 Ack=43 Win=135 Len=1460 [TCP segment of a reassembled PDU]"
"218","0.637108","108.62.5.3","10.120.238.0","TCP","1514","443  >  49236 [ACK] Seq=294921 Ack=43 Win=135 Len=1460 [TCP segment of a reassembled PDU]"
"219","0.637108","108.62.5.3","10.120.238.0","TCP","1514","443  >  49236 [ACK] Seq=296381 Ack=43 Win=135 Len=1460 [TCP segment of a reassembled PDU]"
"220","0.637108","108.62.5.3","10.120.238.0","TCP","1514","443  >  49236 [ACK] Seq=297841 Ack=43 Win=135 Len=1460 [TCP segment of a reassembled PDU]"
"221","0.637108","108.62.5.3","10.120.238.0","TCP","1514","443  >  49236 [ACK] Seq=299301 Ack=43 Win=135 Len=1460 [TCP segment of a reassembled PDU]"
"222","0.637108","108.62.5.3","10.120.238.0","TCP","1514","443  >  49236 [ACK] Seq=300761 Ack=43 Win=135 Len=1460 [TCP segment of a reassembled PDU]"
"223","0.637108","108.62.5.3","10.120.238.0","TCP","1514","443  >  49236 [ACK] Seq=302221 Ack=43 Win=135 Len=1460 [TCP segment of a reassembled PDU]"
"224","0.637108","108.62.5.3","10.120.238.0","TCP","1514","443  >  49236 [ACK] Seq=303681 Ack=43 Win=135 Len=1460 [TCP segment of a reassembled PDU]"
"225","0.637108","108.62.5.3","10.120.238.0","TCP","1514","443  >  49236 [ACK] Seq=305141 Ack=43 Win=135 Len=1460 [TCP segment of a reassembled PDU]"
"226","0.637108","108.62.5.3","10.120.238.0","TCP","1514","443  >  49236 [ACK] Seq=306601 Ack=43 Win=135 Len=1460 [TCP segment of a reassembled PDU]"
"227","0.637108","108.62.5.3","10.120.238.0","TCP","1514","443  >  49236 [ACK] Seq=308061 Ack=43 Win=135 Len=1460 [TCP segment of a reassembled PDU]"
"228","0.637108","108.62.5.3","10.120.238.0","SSLv2","1514","Encrypted Data [TCP segment of a reassembled PDU]"
"229","0.637108","108.62.5.3","10.120.238.0","TCP","1514","443  >  49236 [ACK] Seq=310981 Ack=43 Win=135 Len=1460 [TCP segment of a reassembled PDU]"
"230","0.637108","108.62.5.3","10.120.238.0","TCP","1514","443  >  49236 [ACK] Seq=312441 Ack=43 Win=135 Len=1460 [TCP segment of a reassembled PDU]"
"231","0.637108","108.62.5.3","10.120.238.0","TCP","1514","443  >  49236 [ACK] Seq=313901 Ack=43 Win=135 Len=1460 [TCP segment of a reassembled PDU]"
"232","0.637108","108.62.5.3","10.120.238.0","TCP","1514","443  >  49236 [ACK] Seq=315361 Ack=43 Win=135 Len=1460 [TCP segment of a reassembled PDU]"
"233","0.637108","108.62.5.3","10.120.238.0","TCP","1514","443  >  49236 [ACK] Seq=316821 Ack=43 Win=135 Len=1460 [TCP segment of a reassembled PDU]"
"234","0.637108","108.62.5.3","10.120.238.0","TCP","1514","443  >  49236 [ACK] Seq=318281 Ack=43 Win=135 Len=1460 [TCP segment of a reassembled PDU]"
"235","0.637108","108.62.5.3","10.120.238.0","TCP","1514","443  >  49236 [ACK] Seq=319741 Ack=43 Win=135 Len=1460 [TCP segment of a reassembled PDU]"
"236","0.637108","108.62.5.3","10.120.238.0","TCP","1514","443  >  49236 [ACK] Seq=321201 Ack=43 Win=135 Len=1460 [TCP segment of a reassembled PDU]"
"237","0.637108","108.62.5.3","10.120.238.0","TCP","1514","443  >  49236 [ACK] Seq=322661 Ack=43 Win=135 Len=1460 [TCP segment of a reassembled PDU]"
"238","0.637108","108.62.5.3","10.120.238.0","TCP","1514","443  >  49236 [ACK] Seq=324121 Ack=43 Win=135 Len=1460 [TCP segment of a reassembled PDU]"
"239","0.637108","108.62.5.3","10.120.238.0","TCP","1514","443  >  49236 [ACK] Seq=325581 Ack=43 Win=135 Len=1460 [TCP segment of a reassembled PDU]"
"240","0.637467","10.120.238.0","108.62.5.3","TCP","54","49236  >  443 [ACK] Seq=43 Ack=327041 Win=32964 Len=0"
"241","0.640950","108.62.5.3","10.120.238.0","TCP","1514","443  >  49236 [ACK] Seq=327041 Ack=43 Win=135 Len=1460 [TCP segment of a reassembled PDU]"
"242","0.640950","108.62.5.3","10.120.238.0","TCP","1514","443  >  49236 [ACK] Seq=328501 Ack=43 Win=135 Len=1460 [TCP segment of a reassembled PDU]"
"243","0.640950","108.62.5.3","10.120.238.0","TCP","1514","443  >  49236 [ACK] Seq=329961 Ack=43 Win=135 Len=1460 [TCP segment of a reassembled PDU]"
"244","0.640950","108.62.5.3","10.120.238.0","TCP","1514","443  >  49236 [ACK] Seq=331421 Ack=43 Win=135 Len=1460 [TCP segment of a reassembled PDU]"
"245","0.640950","108.62.5.3","10.120.238.0","TCP","1514","443  >  49236 [ACK] Seq=332881 Ack=43 Win=135 Len=1460 [TCP segment of a reassembled PDU]"
"246","0.640950","108.62.5.3","10.120.238.0","SSLv2","1514","Encrypted Data [TCP segment of a reassembled PDU]"
"247","0.640950","108.62.5.3","10.120.238.0","TCP","1514","443  >  49236 [ACK] Seq=335801 Ack=43 Win=135 Len=1460 [TCP segment of a reassembled PDU]"
"248","0.640950","108.62.5.3","10.120.238.0","TCP","1514","443  >  49236 [ACK] Seq=337261 Ack=43 Win=135 Len=1460 [TCP segment of a reassembled PDU]"
"249","0.640950","108.62.5.3","10.120.238.0","TCP","1514","443  >  49236 [ACK] Seq=338721 Ack=43 Win=135 Len=1460 [TCP segment of a reassembled PDU]"
"250","0.640950","108.62.5.3","10.120.238.0","SSLv2","1514","Encrypted Data [TCP segment of a reassembled PDU]"
"251","0.640950","108.62.5.3","10.120.238.0","TCP","1514","443  >  49236 [ACK] Seq=341641 Ack=43 Win=135 Len=1460 [TCP segment of a reassembled PDU]"
"252","0.640950","108.62.5.3","10.120.238.0","TCP","1514","443  >  49236 [ACK] Seq=343101 Ack=43 Win=135 Len=1460 [TCP segment of a reassembled PDU]"
"253","0.640950","108.62.5.3","10.120.238.0","TCP","1514","443  >  49236 [ACK] Seq=344561 Ack=43 Win=135 Len=1460 [TCP segment of a reassembled PDU]"
"254","0.640950","108.62.5.3","10.120.238.0","TCP","1514","443  >  49236 [ACK] Seq=346021 Ack=43 Win=135 Len=1460 [TCP segment of a reassembled PDU]"
"255","0.640950","108.62.5.3","10.120.238.0","TCP","1514","443  >  49236 [ACK] Seq=347481 Ack=43 Win=135 Len=1460 [TCP segment of a reassembled PDU]"
"256","0.640950","108.62.5.3","10.120.238.0","TCP","1514","443  >  49236 [ACK] Seq=348941 Ack=43 Win=135 Len=1460 [TCP segment of a reassembled PDU]"
"257","0.640950","108.62.5.3","10.120.238.0","TCP","1514","443  >  49236 [ACK] Seq=350401 Ack=43 Win=135 Len=1460 [TCP segment of a reassembled PDU]"
"258","0.640950","108.62.5.3","10.120.238.0","TCP","1514","443  >  49236 [ACK] Seq=351861 Ack=43 Win=135 Len=1460 [TCP segment of a reassembled PDU]"
"259","0.640950","108.62.5.3","10.120.238.0","TCP","1514","443  >  49236 [ACK] Seq=353321 Ack=43 Win=135 Len=1460 [TCP segment of a reassembled PDU]"
"260","0.640950","108.62.5.3","10.120.238.0","TCP","1514","443  >  49236 [ACK] Seq=354781 Ack=43 Win=135 Len=1460 [TCP segment of a reassembled PDU]"
"261","0.640950","108.62.5.3","10.120.238.0","TCP","1514","443  >  49236 [ACK] Seq=356241 Ack=43 Win=135 Len=1460 [TCP segment of a reassembled PDU]"
"262","0.640950","108.62.5.3","10.120.238.0","TCP","1514","443  >  49236 [ACK] Seq=357701 Ack=43 Win=135 Len=1460 [TCP segment of a reassembled PDU]"
"263","0.640950","108.62.5.3","10.120.238.0","TCP","1514","443  >  49236 [ACK] Seq=359161 Ack=43 Win=135 Len=1460 [TCP segment of a reassembled PDU]"
"264","0.640950","108.62.5.3","10.120.238.0","TCP","1514","443  >  49236 [ACK] Seq=360621 Ack=43 Win=135 Len=1460 [TCP segment of a reassembled PDU]"
"265","0.640950","108.62.5.3","10.120.238.0","TCP","1514","443  >  49236 [ACK] Seq=362081 Ack=43 Win=135 Len=1460 [TCP segment of a reassembled PDU]"
"266","0.640950","108.62.5.3","10.120.238.0","TCP","1514","443  >  49236 [ACK] Seq=363541 Ack=43 Win=135 Len=1460 [TCP segment of a reassembled PDU]"
"267","0.640950","108.62.5.3","10.120.238.0","SSLv2","1514","Encrypted Data [TCP segment of a reassembled PDU]"
"268","0.640950","108.62.5.3","10.120.238.0","SSLv2","1514","Encrypted Data [TCP segment of a reassembled PDU]"
"269","0.640950","108.62.5.3","10.120.238.0","TCP","1514","443  >  49236 [ACK] Seq=367921 Ack=43 Win=135 Len=1460 [TCP segment of a reassembled PDU]"
"270","0.640950","108.62.5.3","10.120.238.0","TCP","1514","443  >  49236 [ACK] Seq=369381 Ack=43 Win=135 Len=1460 [TCP segment of a reassembled PDU]"
"271","0.640950","108.62.5.3","10.120.238.0","TCP","1514","443  >  49236 [ACK] Seq=370841 Ack=43 Win=135 Len=1460 [TCP segment of a reassembled PDU]"
"272","0.641168","10.120.238.0","108.62.5.3","TCP","54","49236  >  443 [ACK] Seq=43 Ack=372301 Win=32964 Len=0"
"273","0.646292","108.62.5.3","10.120.238.0","TCP","1514","443  >  49236 [ACK] Seq=372301 Ack=43 Win=135 Len=1460 [TCP segment of a reassembled PDU]"
"274","0.646292","108.62.5.3","10.120.238.0","TCP","1514","443  >  49236 [ACK] Seq=373761 Ack=43 Win=135 Len=1460 [TCP segment of a reassembled PDU]"
"275","0.646292","108.62.5.3","10.120.238.0","TCP","1514","443  >  49236 [ACK] Seq=375221 Ack=43 Win=135 Len=1460 [TCP segment of a reassembled PDU]"
"276","0.646292","108.62.5.3","10.120.238.0","SSLv2","1514","Encrypted Data, Encrypted Data"
"277","0.646292","108.62.5.3","10.120.238.0","SSLv2","1514","Encrypted Data [TCP segment of a reassembled PDU]"
"278","0.646292","108.62.5.3","10.120.238.0","TCP","1514","443  >  49236 [ACK] Seq=379601 Ack=43 Win=135 Len=1460 [TCP segment of a reassembled PDU]"
"279","0.646292","108.62.5.3","10.120.238.0","TCP","1514","443  >  49236 [ACK] Seq=381061 Ack=43 Win=135 Len=1460 [TCP segment of a reassembled PDU]"
"280","0.646292","108.62.5.3","10.120.238.0","TCP","1514","443  >  49236 [ACK] Seq=382521 Ack=43 Win=135 Len=1460 [TCP segment of a reassembled PDU]"
"281","0.646292","108.62.5.3","10.120.238.0","TCP","1514","443  >  49236 [ACK] Seq=383981 Ack=43 Win=135 Len=1460 [TCP segment of a reassembled PDU]"
"282","0.646292","108.62.5.3","10.120.238.0","TCP","1514","443  >  49236 [ACK] Seq=385441 Ack=43 Win=135 Len=1460 [TCP segment of a reassembled PDU]"
"283","0.646435","10.120.238.0","108.62.5.3","TCP","54","49236  >  443 [ACK] Seq=43 Ack=386901 Win=32964 Len=0"
"284","0.827165","10.120.238.0","31.13.68.60","TLSv1.2","94","Application Data"
"285","0.845774","31.13.68.60","10.120.238.0","TCP","54","443  >  49245 [ACK] Seq=1 Ack=41 Win=532 Len=0"
"286","0.869405","108.62.5.3","10.120.238.0","TCP","1514","443  >  49236 [ACK] Seq=386901 Ack=43 Win=135 Len=1460 [TCP segment of a reassembled PDU]"
"287","0.869405","108.62.5.3","10.120.238.0","TCP","1514","443  >  49236 [ACK] Seq=388361 Ack=43 Win=135 Len=1460 [TCP segment of a reassembled PDU]"
"288","0.869405","108.62.5.3","10.120.238.0","TCP","1514","443  >  49236 [ACK] Seq=389821 Ack=43 Win=135 Len=1460 [TCP segment of a reassembled PDU]"
"289","0.869405","108.62.5.3","10.120.238.0","TCP","1514","443  >  49236 [ACK] Seq=391281 Ack=43 Win=135 Len=1460 [TCP segment of a reassembled PDU]"
"290","0.869405","108.62.5.3","10.120.238.0","TCP","1514","443  >  49236 [ACK] Seq=392741 Ack=43 Win=135 Len=1460 [TCP segment of a reassembled PDU]"
"291","0.869405","108.62.5.3","10.120.238.0","SSLv2","1514","Encrypted Data [TCP segment of a reassembled PDU]"
"292","0.869405","108.62.5.3","10.120.238.0","TCP","1514","443  >  49236 [ACK] Seq=395661 Ack=43 Win=135 Len=1460 [TCP segment of a reassembled PDU]"
"293","0.869405","108.62.5.3","10.120.238.0","TCP","1514","443  >  49236 [ACK] Seq=397121 Ack=43 Win=135 Len=1460 [TCP segment of a reassembled PDU]"
"294","0.869405","108.62.5.3","10.120.238.0","TCP","1514","443  >  49236 [ACK] Seq=398581 Ack=43 Win=135 Len=1460 [TCP segment of a reassembled PDU]"
"295","0.869405","108.62.5.3","10.120.238.0","TCP","1514","443  >  49236 [ACK] Seq=400041 Ack=43 Win=135 Len=1460 [TCP segment of a reassembled PDU]"
"296","0.869405","108.62.5.3","10.120.238.0","SSLv2","1514","Encrypted Data [TCP segment of a reassembled PDU]"
"297","0.869405","108.62.5.3","10.120.238.0","TCP","1514","443  >  49236 [ACK] Seq=402961 Ack=43 Win=135 Len=1460 [TCP segment of a reassembled PDU]"
